id,title,score,num_comments,post_hint,self_text,author_name,url
tzaw3i,"2nd post regarding Biden. again, he's not left wing, what he is, is a joke.",8109,736,image,,the_red_guard,https://i.redd.it/dliu0r47tcs81.jpg
187fcip,Henry Kissinger is dead. Why is that a good thing?,1702,137,,"Hello everyone,

**Henry Kissinger is dead, and this is a good thing**. Some of you may understand this, understand that Kissinger was (lol, was) a bad person and remained a bad person until he died on Wednesday. But you may not be fully familiar with all the reasons why he was a bad person. 

Over the next few weeks, as you celebrate the prick's death, right-wing/liberal news media will spend its time trying to celebrate the man's life; trying to present him in a positive light while covering up his many crimes. And other liberals will be out shaming you for rightfully celebrating. 

It is therefore very important that we layout some basic facts as to why Henry Kissinger is a bad person and why it's a good thing he's dead (though the prick should have died decades ago).

So first, let's lay out some basic facts about Henry Kissinger.

Kissinger held two important offices in his lifetime:

- **National Security Advisor** (1969-1975)

- **Secretary of State** (1973-1977) 

Immediately it should be clear to you the role this man played in directing much of the US Empire's foreign policy during the latter half of the 20th Century.

Now, let's get more specific about Henry Kissinger's crimes against humanity.

**Angola**

- Henry Kissinger while Sec. of State, was responsible for US involvement in the Angolan Civil War
  - Through Operation IA Feature in 1975, Kissinger secretly aided the fascist groups UNITA and FNLA in their insurgency against the democratic Angolan government. 
   - Kissinger also backed Apartheid South Africa's Operation Savannah (1975-1976), a secret invasion of Angola
     - the role of an openly white supremacist state like Apartheid South Africa in this war says a lot.
  - The civil war lasted 26 years with full US support throughout. 800,000 Angolan people were killed. 

**Argentina**

- In 1976, as part of Kissinger's Operation Condor, there was a CIA-backed coup of the democratic Peronist government, installing dictator Jorge Rafael Videla
  - During his time in power he used the fascist Triple A militia as well as his own military forces to kill up to 30,000 political dissidents including nuns, teachers, artists, labour unionists and thousands of students. 1.9k-3k Jewish people were also targeted. 

**Bangladesh & Pakistan**

- Kissinger's State Department supported Pakistan's 1971 genocidal campaign in Bangladesh which resulted in the deaths of **3 million** Bangladeshis.

**Brazil**

- Kissinger was involved in materially supporting the military dictatorship in Brazil during his time in government. 
   - The regime tortured and killed hundreds of Brazilians accused of political dissidence. All perpetrators were pardoned.  

**Bolivia**

- As part of Kissinger's Operation Condor, in 1971 a CIA-backed coup overthrew the democratic government of Bolivia and installed dictator Hugo Banzer.
   - The Banzer regime tortured, raped and killed over 2,000 political opponents in the aftermath of this coup

**Chile**

- Kissinger was responsible for the 1973 coup in Chile. Kissinger used the CIA to destabilise the democratic Allende government and lay the foundation for the Augusto Pinochet's fascist junta government.
  - Under the Pinochet regime, at least 27,255 people were tortured and 2,279 people were killed. Much of this was part of Operation Condor.

**Indonesia & East Timor**

- Kissinger supported the invasion of East Timor by fascist Indonesian dictator Suharto (installed in 1968 by the previous US administration). 
   - The Indonesian military occupied East Timor for 23 years. Over 200,000 Timorese people were killed during both the invasion and the occupation. This was around a third of its population. The massacre is known as the East Timor Genocide.

**Indochina (Cambodia, Laos & Vietnam)**

- During the Second Indochina War (aka the Vietnam War), Kissinger was involved in the planning and execution of Operation Menu (1969-1970) which involved the illegal carpet bombing of Cambodia in an attempt to destroy the supply routes of the Vietnamese resistance.
   - This Operation was considered a failure and resulted in over 4,000 civilian deaths

- Kissinger also ordered the similar Operation Freedom Deal (1970-1973). This period of carpet bombing killed 50,000 to 150,000 civilians.

- Kissinger was party to the illegal 'secret war' in Laos. The bombing campaign Operation Barrel Roll killed tens of thousands between 1964 and 1973, yet the US failed to achieve its military objectives. 

- After peace negotiations went south in 1972, Kissinger and Nixon orchestrated Operation Linebacker II, killing over 1.5k civilians between 18 December and 29 December. These were known as the 'Christmas Bombings'.

- Kissinger was involved in the implementation of Operation Popeye, a chemical weather modification program intending to extend the monsoon season to try and disrupt the Vietnamese resistance's movements. 

- Kissinger was involved in planning Operation Duck Hook, pushing for a nuclear attack on Vietnam. Thankfully this Operation never came to fruition. 

**Paraguay**

- Kissinger's State Department supported the genocidal dictatorship of Alfredo Stroessner
  - Stroessner was responsible for the enslavement and genocide of the indigenous Ache people.
   - With CIA support, as part of Operation Condor, Stroessner partook in brutal repressions of political dissidents, including torture and extrajudicial executions.

**Peru**

- Kissinger supported Morales Bermudez' fascist dictatorship in Peru
  - Bermudez was also linked with Kissinger's Operation Condor

**Uruguay**

- The Kissinger State Department supported the 'Civic-Military Dictatorship' of Juan Maria Bordaberry after his coup in 1973
   - The dictator killed countless trade unionists who led a peaceful general strike against his despotic government
   - Boradaberry was linked to Kissinger's Operation Condor.

**Western Sahara**

- Kissinger supported the Moroccan invasion of Western Sahara in 1975, rather than permit the self-determination of the Sahrawi Republic following their seizure of independence from Spain.



**Henry Kissinger was awarded the Nobel Peace Prize in 1973.**

**Henry Kissinger is responsible for the deaths of millions.**

**Henry Kissinger is dead now.**

I hope his final years were as painful and miserable as possible.",RoyallyScrewed75,https://www.reddit.com/r/TheRightCantMeme/comments/187fcip/henry_kissinger_is_dead_why_is_that_a_good_thing/
1alq3i7,One of these made a billion dollars tho,647,52,image,,demonbeastking,https://i.redd.it/76foszyrbbhc1.jpeg
1alw8gd,I dont Even know what to say...,148,9,image,,Legitimate-Excuse-84,https://i.redd.it/49vgingdadhc1.png
1alwb5g,Miss Grotke from “Recess” was based AF,145,9,image,,Aqn95,https://i.redd.it/efjc9bt1bdhc1.jpeg
1aldddh,This is a new low for Musk,2555,95,image,,IAmNMFlores,https://i.redd.it/71sn4lj588hc1.jpeg
1alqopm,Avocado toast ass bullshit argument,302,35,image,,demonbeastking,https://i.redd.it/ic13qz76jbhc1.jpeg
1alijt1,„If Netflix made a documantary about chess today”,1118,85,image,pOliTicAL cOrRecTnESs,IAMPURINA,https://i.redd.it/5gcirordb9hc1.jpeg
1almx66,"Far right activist 30 years ago, feeling solidarity with elitists",319,6,image,,paz2023,https://i.redd.it/afkoqdhqdahc1.jpeg
1alwebe,So just straight up cherry picking at this point.,53,8,image,,Butters12Stotch,https://i.redd.it/6mxi4hqpbdhc1.jpeg
1alpdqa,ah yes elon echo chamber,185,11,,source: https://www.facebook.com/100088486716722/posts/pfbid02r3F1knmT4hD7zcXh1KKQSoZwzPRSeCu7UXjN1Bd7RFWDj6BMEnomBmm1vEu3S9ZMl/?app=fbl,Traditional_Light863,https://www.reddit.com/gallery/1alpdqa
1alqpqf,(unemployed noises) did finally get me,134,8,image,,demonbeastking,https://i.redd.it/nuxw0x1ijbhc1.jpeg
1almiku,“I go there for funny memes” bigots being bigots I guess.,265,15,image,,Banjomanmart,https://i.redd.it/4za4vow2aahc1.jpeg
1alcv02,These are so 2010,764,13,,On post about how much Elon Musk is tweeting/retweeting/liking transphobia (pictures included). Then someone forcing themselves to find them “funny” at the end.,Decent-Candidate-967,https://www.reddit.com/gallery/1alcv02
1aly62s,I’m pretty sure these people actually wanna have sex with him,23,4,image,,cayce_leighann,https://i.redd.it/9ktuact8qdhc1.jpeg
1alq46z,She must never go online at this point,67,11,image,,demonbeastking,https://i.redd.it/mnw6y5zzbbhc1.jpeg
1al0n50,Rightists and gaming doesn't mix well,2026,95,image,,GregoriousT-GTNH,https://i.redd.it/81xrkwxmb5hc1.png
1alvuer,"“Dear heavens, it’s someone from… the Middle East!”",10,2,image,This is from a group on Quora called “it’s ok to be white” which I keep getting recommended. Quora is a nuthouse.,Sgyinne,https://i.redd.it/mpol2o4u6dhc1.jpeg
1al5u2g,"WOW, So Funny To Alter Your MTG Cards Like That",488,62,,"Should also mention that there's an additional layer to this that the artist is Terese Neilsen.

If you don't know who she is,  she's MTG's version of J. K. Rowling.",CaptinKarnage,https://www.reddit.com/gallery/1al5u2g
1alp6fk,incels+rightoids+persecutionfetish,32,1,,source: https://www.facebook.com/groups/kenposting/permalink/1852431515171042/?app=fbl,Traditional_Light863,https://www.reddit.com/gallery/1alp6fk
1al48nl,...,491,28,image,,Snoo4902,https://i.redd.it/epl5lldpb6hc1.jpeg
1al51n7,They get bodied in their own meme,308,30,image,,Grimupnorthsausage,https://i.redd.it/mf1c4vtci6hc1.jpeg
1alyvqc,They've been recycling the same 5 or 6 jokes for years.,3,1,image,,WaylonGreyjoy,https://i.redd.it/yihm9vbwvdhc1.jpeg
1akx5sd,"""Good argument for diversity. Unfortunately, I have won by simply portraying you as a balding soyjack.""",1215,44,image,,Violet_Nightshade,https://i.redd.it/g0h8di3e44hc1.jpeg
1akyteg,They're actually going mask off about getting rid of Social Security,727,58,image,,FewAir5,https://i.redd.it/y6sd62fmp4hc1.png
1akxev0,"Elon, shut the fuck up, you're embarrassing South Africa",806,43,image,,PersonaGuy5,https://i.redd.it/a5fhyihg74hc1.jpeg
1al7vv9,Found this on Quora. Makes me wonder why I still use it.,88,18,image,,Sgyinne,https://i.redd.it/eerl9cbt37hc1.jpeg
1akmhtw,Here we go again,2896,124,image,,demonbeastking,https://i.redd.it/lm9qqw9ii1hc1.jpeg
1aknlue,"""Stupid lefties, I hate no one"" then proceeds to spout the most bigoted filth imaginable.",1098,85,image,,Otherwise-Heron2346,https://i.redd.it/9ippnramq1hc1.jpeg
1aktxvm,Door makes the rules,364,17,image,,Lord_Abigor123,https://i.redd.it/ka1pn0dh73hc1.png
1akuan6,Cope and Seethe,306,21,image,,cheaproot,https://i.redd.it/mqx7mdvta3hc1.png
1akfrfu,Only taught LGBT in college,1626,49,image,,tyw7,https://i.redd.it/nxqbmpbf60hc1.png
1akmjgq,Are they calling them gay derogatorily?,414,37,image,,demonbeastking,https://i.redd.it/nrsnuiyti1hc1.jpeg
1akecey,More Homophobia,914,27,image,,PeterVanHelsing,https://i.redd.it/oy8z15vwvzgc1.jpeg
1ak7n61,Religious extremists are nuts,1698,137,image,,TBNSK74,https://i.redd.it/9b3o2cnnaygc1.jpeg
1akvult,"Far right activist on immigration, 17 years ago",56,2,,,paz2023,https://www.reddit.com/gallery/1akvult
1akejum,I need to comment?,476,32,image,,LowPuzzleheaded3393,https://i.redd.it/eh67pjbixzgc1.jpeg
1akak34,What do they even base this stuff on?,575,26,image,,RFever,https://i.redd.it/ngbn3qsn2zgc1.jpeg
1akc8u3,"This guy called this a ""joke""",460,14,image,,Butters12Stotch,https://i.redd.it/iqu2fkvxfzgc1.jpeg
1aki5j4,It's crazy how the army doesn't exist in 2024,102,11,image,,SqmButBetter,https://i.redd.it/f7gnsrlmn0hc1.jpeg
1ak5e1z,Turns out far right activists don't like law and order,418,9,,,paz2023,https://www.reddit.com/gallery/1ak5e1z
1akh4av,"More from Mitch Conner, this time with the Impact Font.",55,3,image,,ehenrie2002,https://i.redd.it/0f4gnh3if0hc1.jpeg
1ajvl7j,"Maga moron thinks everyone’s life revolves around trump, not just theirs. Maybe they’re mad we didn’t listen when trump told us to inject bleach products.",655,42,image,,taxevader2525,https://i.redd.it/o7gn8u31uugc1.jpeg
1ajt7b0,What level of conspiracy theory is this?,845,43,image,,Saint-Redfield,https://i.redd.it/0ox28oj2cugc1.jpeg
1ajnjzz,"I still can't believe this conspiracy theory is still around. Get new material, you hacks!",940,60,image,,Mrdean2013,https://i.redd.it/d9htq31q7tgc1.jpeg
1ajh1mt,"""Communism is when no free speech""",1577,86,image,,Blake_The_Snake64,https://i.redd.it/mlaz02tfvrgc1.jpeg
1ajhxj7,Not even dark humor just racism,629,26,image,,Sarahisahill,https://i.redd.it/xbxrlvhn2sgc1.png
1ajnoff,Lmaoo noo not the minions,177,9,image,,angieemann,https://i.redd.it/8cswj45m8tgc1.jpeg
1aj8egm,Low-wage workers are in poverty due to their high taxes going to people who don't work.,1781,44,image,,needlenozened,https://i.redd.it/sipwyi3z6pgc1.png
1ajkbyk,God forbid women *shuffles hat*.... dance,102,9,image,,cheaproot,https://i.redd.it/u206ajl5lsgc1.jpeg
1ajo1lp,Not a meme but vomit inducing nonetheless - 🤮😢🤯,63,3,image,,Grimupnorthsausage,https://i.redd.it/bwwstby8btgc1.jpeg
1aj6vpw,Hitler good it’s time to wake up,778,32,image,,taxevader2525,https://i.redd.it/onwhqdzgsogc1.jpeg
1ajeycx,I am actually losing braincells,122,10,image,,Reddit_username_woag,https://i.redd.it/l0buqrmzbrgc1.jpeg
1aiu1q4,Leave Aragon outta this!,1011,78,image,,cayce_leighann,https://i.redd.it/u3i56ynsylgc1.jpeg
1aj08vo,do i even have to say anything,425,51,image,,TravisPorerr,https://i.redd.it/xsrnadp68ngc1.jpeg
1aiso8s,Vile antisemtic meme from the cesspool imgflip,1099,45,image,,avengentnecronomicon,https://i.redd.it/oqyj6vgholgc1.png
1aiqh0a,bush was a far right extremist too,1171,45,image,,paz2023,https://i.redd.it/gvestlqi7lgc1.jpeg
1aisx9r,Oh god,733,28,image,,Sarahisahill,https://i.redd.it/usjmhxgfqlgc1.png
1aiu0qk,Yeah a “real hero”,527,43,image,,cayce_leighann,https://i.redd.it/abg9ne9lylgc1.jpeg
1aitzpl,And how did that work out for ya last time,471,45,image,,cayce_leighann,https://i.redd.it/2q68ygbfylgc1.jpeg
1aimwm5,Like having free health care?,1163,117,image,,Flaky-Fishing7543,https://i.redd.it/w6ax5ly0ckgc1.jpeg
1aizh8c,"By a lightskinned male, far right activist from australia (warning for multiple nazi references +)",147,11,,,paz2023,https://www.reddit.com/gallery/1aizh8c
1aihnxo,🤔,1819,83,image,,anonlt1024,https://i.redd.it/wfg9xwjzligc1.jpeg
1aivgfp,Are you sure about that?!!!(2x),183,17,image,,latitus78,https://i.redd.it/tk8fr9369mgc1.png
1aids29,Least terroristic Trump supporter,302,4,image,,Striking-Use-8021,https://i.redd.it/ob2x76v9ihgc1.jpeg
1aiapqg,What?,337,31,image,,SpezIsAPissBaby0002,https://i.redd.it/s6byzotjqggc1.jpeg
1ai9cee,"Pro god? Ah, the rule of 3.. lol",386,29,image,,Grimupnorthsausage,https://i.redd.it/wkvbo0mgfggc1.jpeg
1ai39hj,Crazy people post crazy comparisons,868,35,image,,teufler80,https://i.redd.it/z2wk33k83fgc1.png
1ahznfk,Why are they acting like they're going to be okay in all this?,1064,80,image,,Butters12Stotch,https://i.redd.it/p66g4slxaegc1.jpeg
1ahrlb5,This sub just got recommended to me…,2256,66,image,Seems like a place for totally rational and intelligent humans.,yaboiGunit,https://i.redd.it/z2ar4jx31cgc1.jpeg
1ai1nel,A la Stephon “this meme has everything…”,327,12,image,,CleverUsername006,https://i.redd.it/7y58e3mkqegc1.jpeg
1ahvb7x,Public School Bad,344,17,image,,Carnizzy,https://i.redd.it/1ucitk179dgc1.jpeg
1ahivc2,This is just silly,928,58,image,,demonbeastking,https://i.redd.it/niony1pcl9gc1.jpeg
1ahcbp6,Kill me,2147,53,image,,V02Ded,https://i.redd.it/5kzony6378gc1.png
1ahiof9,She seems chill,695,118,image,,demonbeastking,https://i.redd.it/c9lai2jrj9gc1.jpeg
1ahmyvm,Minimum wages what the workers don't under suffered,270,25,image,,Left_Malay_10,https://i.redd.it/wxznta3nmagc1.jpeg
1ah9qzx,"""It's just a joke guys! God you're so sensitive"" -🤓",1704,23,image,,TheFakestOfBricks,https://i.redd.it/0l6fadann7gc1.jpeg
1ahkskd,"Yes, because trans people didn't exist before TikTok came around. Oh wait... nevermind.",369,33,image,,DaBloodyApostate,https://i.redd.it/t7peau3f2agc1.jpeg
1ahixcb,Duh,489,29,image,,Left_Malay_10,https://i.redd.it/dzmd5p9wl9gc1.jpeg
1ahip77,The meds steal my freedoms,475,53,image,,demonbeastking,https://i.redd.it/86yywgyxj9gc1.jpeg
1ahm8d0,Transphobic and Offensive to victims of shootings. A two for one deal.,184,18,image,,ehenrie2002,https://i.redd.it/53kd0snkfagc1.png
1ah6l1c,Rocket throw fan are Nazis,770,33,image,,Butters12Stotch,https://i.redd.it/xaq1ybgoz6gc1.jpeg
1ahiqeg,Thomas Jefferson molested a slave named Sally Hemmings…,135,20,image,,demonbeastking,https://i.redd.it/qbhh2em7k9gc1.jpeg
1ah3162,"Into the unhealthy mind of a far right activist in spain (warnings for violence, antisemitism, +)",863,34,,,paz2023,https://www.reddit.com/gallery/1ah3162
1ahhhxs,Worship is when you treat others as human beings.,113,9,image,,cheaproot,https://i.redd.it/t7n3pywda9gc1.jpeg
1agzpel,Oldie but a mouldy x,1171,69,image,,Grimupnorthsausage,https://i.redd.it/w2pc1mvw35gc1.jpeg
1agyr36,I take from a comic than I found just to say is stupid. Just stupid like the racist they are.,1103,113,image,,LowPuzzleheaded3393,https://i.redd.it/o4z6b8ler4gc1.jpeg
1ah76wy,I'm not even sure what the implication is here.,256,10,image,,WaylonGreyjoy,https://i.redd.it/3kv28a3g47gc1.jpeg
1ah9f0k,Could it be that a cashgrab with bad writing makes it bad and not muh wokies? Hmmm,116,16,image,,constantlytired1917,https://i.redd.it/56jhkf35l7gc1.jpeg
1agvcr2,"Call me silly, but living somewhere does not merit a special flag.",1164,82,image,,Ilikegermanymemes,https://i.redd.it/5kfh99jfp3gc1.jpeg
1ah0uop,DeSantis actually don't want children more clever,315,19,image,,Left_Malay_10,https://i.redd.it/tmkrlfsfi5gc1.jpeg
1agyv06,Wow so based....,386,27,image,,Ok_Grocery_5188,https://i.redd.it/qsgj2oius4gc1.jpeg
1agyd72,The ku klux Klan is angry again,228,16,image,,Legitimate-Excuse-84,https://i.redd.it/0wk85yklm4gc1.png
1agigpk,Hot take but being a bigot does actually hurt people.,2390,99,image,,Butters12Stotch,https://i.redd.it/z0090658t0gc1.jpeg
1agmquv,"Far right can't meme, australia edition. Why do they compare everything they don't like to far right nazis?",791,27,image,,paz2023,https://i.redd.it/z5o25kn2p1gc1.jpeg
1agde4c,Seems hyperbolic but go off and all that,1002,79,image,,demonbeastking,https://i.redd.it/uia43102rzfc1.jpeg
1ag9ipp,They really can't meme,1550,113,image,Some real 'boomer'/English Teacher ass memeing.,GrizzlyPeak73,https://i.redd.it/pftrccc0tyfc1.jpeg
1agi5i6,YT Shorts is unhinged,307,12,,The comment is not under the specific video in the screenshot just for clarity,Official_Indie_Freak,https://www.reddit.com/gallery/1agi5i6
1agdegb,Don’t bring Lisa into this,538,35,image,,demonbeastking,https://i.redd.it/2wl8qup4rzfc1.jpeg
1agdgzy,There’s Asians strip mining Africa right now,495,22,image,,demonbeastking,https://i.redd.it/rxcnfuvnrzfc1.jpeg
